{
  "id": "fugiat nulla eu",
  "maxPerPeriodTransactionCount": 34234684,
  "maxPerPeriodAmount": null,
  "mediaType": "anim qui eu cupidatat incididunt",
  "typeRequiredIdentification": "aliquip ea",
  "auditInfo": {
    "isDeleted": null,
    "createdBy": "officia",
    "updatedBy": "magna sed",
    "updatedDate": "1974-04-21T01:12:28.801Z",
    "createdDate": null
  },
  "maxTransactionAmount": -73508510,
  "useMinimumAgeYear": null,
  "name": "voluptate enim irure ut id"
}
